{
    "$schema": "http://json-schema.org/draft-07/schema#",
    "$id": "https://raw.githubusercontent.com/dedis/popstellar/master/protocol/query/method/rumor.json",
    "description": "Rumor that should be spread across the network",
    "type": "object",
    "additionalProperties": false,
    "properties": {
        "method": {
            "description": "[String] operation to be performed by the query",
            "const": "rumor"
        },

        "params": {
            "type": "object",
            "additionalProperties": false,
            "properties": {
                "sender_id": {
                    "description": "[String] publish key of the sender's server",
                    "type": "string",
                    "contentEncoding": "base64"
                },
                "rumor_id": {
                    "description": "[Integer] ID of the rumor",
                    "type": "integer"
                },
                "messages": {
                    "description": "Key-value of channels and messages per channel",
                    "type": "object",
                    "$ref": "../../answer/result/messages_by_channel.json"
                }
            },
            "required": ["sender_id", "rumor_id", "messages"]
        },

        "jsonrpc": {
            "$comment": "Defined by the parent, but needed here for the validation"
        },

        "id": {
            "type": "integer"
        }
    },

    "required": ["method", "params", "id", "jsonrpc"]
}
