{
    "jsonrpc": "2.0",
    "id": 4,
    "method": "rumor",
    "params": {
        "sender_id": "J9fBzJV70Jk5c-i3277Uq4CmeL4t53WDfUghaK0HpeM=",
        "rumor_id": 0,
        "messages": {
            "/root/nLghr9_P406lfkMjaNWqyohLxOiGlQee8zad4qAfj18=/social/8qlv4aUT5-tBodKp4RszY284CFYVaoDZK6XKiw9isSw=": [
                {
                    "data": "eyJvYmplY3QiOiJyb2xsX2NhbGwiLCJhY3Rpb24iOiJjcmVhdGUiLCJuYW1lIjoiUm9sbCBDYWxsIiwiY3JlYXRpb24iOjE2MzMwMzYxMjAsInByb3Bvc2VkX3N0YXJ0IjoxNjMzMDM2Mzg4LCJwcm9wb3NlZF9lbmQiOjE2MzMwMzk2ODgsImxvY2F0aW9uIjoiRVBGTCIsImlkIjoial9kSmhZYnpubXZNYnVMc0ZNQ2dzYlB5YjJ6Nm1vZ2VtSmFON1NWaHVVTT0ifQ==",
                    "sender": "J9fBzJV70Jk5c-i3277Uq4CmeL4t53WDfUghaK0HpeM=",
                    "signature": "FFqBXhZSaKvBnTvrDNIeEYMpFKI5oIa5SAewquxIBHTTEyTIDnUgmvkwgccV9NrujPwDnRt1f4CIEqzXqhbjCw==",
                    "message_id": "DCBX48EuNO6q-Sr42ONqsj7opKiNeXyRzrjqTbZ_aMI=",
                    "witness_signatures": []
                }
            ],
            "/root/nLghr9_P406lfkMjaNWqyohLxOiGlQee8zad4qAfj18=/HnXDyvSSron676Icmvcjk5zXvGLkPJ1fVOaWOxItzBE=": [
                {
                    "data": "eyJvYmplY3QiOiJyb2xsX2NhbGwiLCJhY3Rpb24iOiJjcmVhdGUiLCJuYW1lIjoiUm9sbCBDYWxsIiwiY3JlYXRpb24iOjE2MzMwMzYxMjAsInByb3Bvc2VkX3N0YXJ0IjoxNjMzMDM2Mzg4LCJwcm9wb3NlZF9lbmQiOjE2MzMwMzk2ODgsImxvY2F0aW9uIjoiRVBGTCIsImlkIjoial9kSmhZYnpubXZNYnVMc0ZNQ2dzYlB5YjJ6Nm1vZ2VtSmFON1NWaHVVTT0ifQ==",
                    "sender": "J9fBzJV70Jk5c-i3277Uq4CmeL4t53WDfUghaK0HpeM=",
                    "signature": "FFqBXhZSaKvBnTvrDNIeEYMpFKI5oIa5SAewquxIBHTTEyTIDnUgmvkwgccV9NrujPwDnRt1f4CIEqzXqhbjCw==",
                    "message_id": "z6SbjJ0Hw36k8L09-GVRq4PNmi06yQX4e8aZRSbUDwc=",
                    "witness_signatures": []
                },
                {
                    "data": "eyJvYmplY3QiOiJyb2xsX2NhbGwiLCJhY3Rpb24iOiJjcmVhdGUiLCJuYW1lIjoiUm9sbCBDYWxsIiwiY3JlYXRpb24iOjE2MzMwMzYxMjAsInByb3Bvc2VkX3N0YXJ0IjoxNjMzMDM2Mzg4LCJwcm9wb3NlZF9lbmQiOjE2MzMwMzk2ODgsImxvY2F0aW9uIjoiRVBGTCIsImlkIjoial9kSmhZYnpubXZNYnVMc0ZNQ2dzYlB5YjJ6Nm1vZ2VtSmFON1NWaHVVTT0ifQ==",
                    "sender": "J9fBzJV70Jk5c-i3277Uq4CmeL4t53WDfUghaK0HpeM=",
                    "signature": "FFqBXhZSaKvBnTvrDNIeEYMpFKI5oIa5SAewquxIBHTTEyTIDnUgmvkwgccV9NrujPwDnRt1f4CIEqzXqhbjCw==",
                    "message_id": "txbTmVMwCDkZdoaAiEYfAKozVizZzkeMkeOlzq5qMlg=",
                    "witness_signatures": []
                }
            ]
        }
    }
}
